rs_id,name,status,scenario_id,action_id,risk_id,likelihood_level,business_impact,data_impact,compliance_impact,notes,mitigation_pre,mitigation_pro
decl-oracle定时备份恢复-9,在进行浏览恢复时需要对客户机数据库状态做相应的更改：1）数据库恢复实例，需将恢复目的地的数据库状态更改为nomount或mount状态；2）恢复控制文件时，数据,active,decl-oracle定时备份恢复-9,decl-action-9,decl-risk-availability-9,,,,,在进行浏览恢复时需要对客户机数据库状态做相应的更改：1）数据库恢复实例，需将恢复目的地的数据库状态更改为nomount或mount状态；2）恢复控制文件时，数据库需启动到nomount状态；3）恢复数据文件时，数据库需启动到mount状态；4）恢复日志时，数据库需启动到mount或open状态，需手工输入归档日志的序列号方可进行恢复，或者指定日志文件恢复的时间范围，默认恢复至原路径；如果指定日志文件的恢复路径，则必须在mount状态下恢复，并且该路径需要有oracle权限。,在进行浏览恢复时需要对客户机数据库状态做相应的更改：1）数据库恢复实例，需将恢复目的地的数据库状态更改为nomount或mount状态；2）恢复控制文件时，数据库需启动到nomount状态；3）恢复数据文件时，数据库需启动到mount状态；4）恢复日志时，数据库需启动到mount或open状态，需手工输入归档日志的序列号方可进行恢复，或者指定日志文件恢复的时间范围，默认恢复至原路径；如果指定日志文件的恢复路径，则必须在mount状态下恢复，并且该路径需要有oracle权限。,
decl-oracle定时备份恢复-10,完全备份、增量备份、归档日志备份请做好合理安排，以免数据丢失。,active,decl-oracle定时备份恢复-10,decl-action-10,decl-risk-data_loss-10,,,,,完全备份、增量备份、归档日志备份请做好合理安排，以免数据丢失。,完全备份、增量备份、归档日志备份请做好合理安排，以免数据丢失。,
decl-oracle定时备份恢复-11,开启trace及日志有撑爆系统盘的风险。,active,decl-oracle定时备份恢复-11,decl-action-11,decl-risk-availability-11,,,,,开启trace及日志有撑爆系统盘的风险。,开启trace及日志有撑爆系统盘的风险。,
decl-oracle定时备份恢复-12,恢复过程中停止任务或恢复失败，未再次执行恢复，会导致数据库损坏或者数据丢失。,active,decl-oracle定时备份恢复-12,decl-action-12,decl-risk-data_loss-12,,,,,恢复过程中停止任务或恢复失败，未再次执行恢复，会导致数据库损坏或者数据丢失。,恢复过程中停止任务或恢复失败，未再次执行恢复，会导致数据库损坏或者数据丢失。,
decl-oracle定时备份恢复-13,处理影响客户问题时，需取消副本保留策略，防止客户副本被误删除。,active,decl-oracle定时备份恢复-13,decl-action-13,decl-risk-data_loss-13,,,,,处理影响客户问题时，需取消副本保留策略，防止客户副本被误删除。,处理影响客户问题时，需取消副本保留策略，防止客户副本被误删除。,
decl-anyshare定时备份恢复-14,备份过程中若AnyShare删除了部分数据，存在数据和一开始获取的元数据不一致的情况，实际被删除的数据未备份，恢复的时候无法恢复。,active,decl-anyshare定时备份恢复-14,decl-action-14,decl-risk-data_loss-14,,,,,备份过程中若AnyShare删除了部分数据，存在数据和一开始获取的元数据不一致的情况，实际被删除的数据未备份，恢复的时候无法恢复。,备份过程中若AnyShare删除了部分数据，存在数据和一开始获取的元数据不一致的情况，实际被删除的数据未备份，恢复的时候无法恢复。,
decl-anyshare定时备份恢复-15,AnyShare整机备份，不支持超过“4M*10000AnyShare服务器的存储最大支持块数量”的文件做备份恢复，存在备份成功但无法恢复的问题。,active,decl-anyshare定时备份恢复-15,decl-action-15,decl-risk-data_loss-15,,,,,AnyShare整机备份，不支持超过“4M*10000AnyShare服务器的存储最大支持块数量”的文件做备份恢复，存在备份成功但无法恢复的问题。,AnyShare整机备份，不支持超过“4M*10000AnyShare服务器的存储最大支持块数量”的文件做备份恢复，存在备份成功但无法恢复的问题。,
decl-anyshare定时备份恢复-16,当AnyShare备份任务运行时，对应AnyShare资源禁止做资源回收，回收后正在运行中的备份任务会直接被删除。,active,decl-anyshare定时备份恢复-16,decl-action-16,decl-risk-data_loss-16,,,,,当AnyShare备份任务运行时，对应AnyShare资源禁止做资源回收，回收后正在运行中的备份任务会直接被删除。,当AnyShare备份任务运行时，对应AnyShare资源禁止做资源回收，回收后正在运行中的备份任务会直接被删除。,
decl-sql_server定时备份恢复-17,SQL Serve恢复完全备份时间点、差异备份时间点恢复成功后数据库偶现正在还原；在数据库的备份数据量增加的情况下，恢复事务日志备份时间点恢复成功后数据库必现正,active,decl-sql_server定时备份恢复-17,decl-action-17,decl-risk-availability-17,,,,,SQL Serve恢复完全备份时间点、差异备份时间点恢复成功后数据库偶现正在还原；在数据库的备份数据量增加的情况下，恢复事务日志备份时间点恢复成功后数据库必现正在还原。后续提供补丁。,SQL Serve恢复完全备份时间点、差异备份时间点恢复成功后数据库偶现正在还原；在数据库的备份数据量增加的情况下，恢复事务日志备份时间点恢复成功后数据库必现正在还原。后续提供补丁。,
decl-sql_server定时备份恢复-18,当前版本一个客户端只允许新建一个SQL Server备份任务,active,decl-sql_server定时备份恢复-18,decl-action-18,decl-risk-availability-18,,,,,当前版本一个客户端只允许新建一个SQL Server备份任务,当前版本一个客户端只允许新建一个SQL Server备份任务,
decl-hadoop定时备份恢复-19,若当次备份任务运行中已产生了时间点，在任务运行未完成时，此时间点的备份数据不完整，禁止使用该时间点做数据恢复。,active,decl-hadoop定时备份恢复-19,decl-action-19,decl-risk-availability-19,,,,,若当次备份任务运行中已产生了时间点，在任务运行未完成时，此时间点的备份数据不完整，禁止使用该时间点做数据恢复。,若当次备份任务运行中已产生了时间点，在任务运行未完成时，此时间点的备份数据不完整，禁止使用该时间点做数据恢复。,
decl-hadoop定时备份恢复-20,不支持两个或多个任务同时恢复同一文件到同一路径，可能会导致数据丢失。,active,decl-hadoop定时备份恢复-20,decl-action-20,decl-risk-data_loss-20,,,,,不支持两个或多个任务同时恢复同一文件到同一路径，可能会导致数据丢失。,不支持两个或多个任务同时恢复同一文件到同一路径，可能会导致数据丢失。,
decl-cdm副本数据管理公共部分-21,备份过程中控制台掉电，可能会导致当前及其他备份任务数据出错，致使数据不可用。为降低此风险，请保证控制台供电稳定。,active,decl-cdm副本数据管理公共部分-21,decl-action-21,decl-risk-availability-21,,,,,备份过程中控制台掉电，可能会导致当前及其他备份任务数据出错，致使数据不可用。为降低此风险，请保证控制台供电稳定。,备份过程中控制台掉电，可能会导致当前及其他备份任务数据出错，致使数据不可用。为降低此风险，请保证控制台供电稳定。,
